{
  "$schema": "../../../tools/schemas/fable2-gpu-fable-relevance-v1.schema.json",
  "schema_version": "1.0.0",
  "corpus": "Fable II Native Renderer G1.5D",
  "generated_on": "2026-09-01",
  "pins": {
    "fable_repository": {
      "path": "C:\\Dev\\Fable2Recomp",
      "branch": "fable2-native-renderer-g1.5-reference",
      "commit": "3cef954120e062974f3fcdf707ac302aa0e2d44e",
      "tree": "e5bcb4029052927c01f0895ac945fb3baa722496"
    },
    "g1": {
      "branch": "fable2-native-renderer-g1-audit",
      "commit": "c44e8c16f4422f9a828caf30899ac989170b8a8c",
      "tree": "f5bde8e945f2d2ab6764c4d9c38f0f3550cac40c"
    },
    "paused_g2a": {
      "branch": "fable2-native-renderer-g2a-forwarding-proof",
      "commit": "47c2ea2b7d9e14b09fd942c4b5f1bd11c46e2f51",
      "tree": "910e80108c2d9e7d8474866506f1c9e23ede601c"
    },
    "rexglue_repository": {
      "path": "C:\\Dev\\rexglue-sdk-v0.10",
      "branch": "fable2-v0.10-migration",
      "commit": "956c6a8b5da4c54b9899a2593e9c67c26de30194",
      "tree": "b78b06b8ac650467372236a3a262864e069a9382"
    },
    "canary_repository": {
      "path": "C:\\Dev\\Fable2NativeRendererResearch\\xenia-canary",
      "branch": "canary_experimental",
      "commit": "3a44f20c7bc66db1da583e8a6f0ab740e31908e9",
      "tree": "c343b0a5796590fadc3b78c993bfada51e7e9148"
    },
    "active_gpu_artifact": {
      "filename": "rexgpu-xenos.dll",
      "path": "C:\\Dev\\Fable2Recomp\\out\\build\\win-amd64-release\\rexgpu-xenos.dll",
      "size": 2770944,
      "sha256": "8232051BED6E5CE99CF37B2EF581C824F58875C140A4D3C75DE14E8A5DF4AA99",
      "backend": "D3D12 only"
    }
  },
  "authoritative_input": {
    "path": "docs/fable2-gpu-reference/evidence/divergence-matrix.json",
    "sha256": "B4BED324837E092BE29BE91D2C5E55CCA6CEFC9884FAFE150CE04F8F02DC261C",
    "record_count": 37
  },
  "evidence_ladder": [
    {
      "level": "L0",
      "definition": "GPU plugin/backend initialized",
      "status": "REACHED",
      "proven": [
        "The exact active rexgpu-xenos.dll loaded and initialized D3D12 on NVIDIA GeForce RTX 5080 in Run 047 and Run 048."
      ],
      "source_connected_only": [],
      "gap_to_next": "None; L0 is complete for the exact D3D12 artifact.",
      "experiment_ids": []
    },
    {
      "level": "L1",
      "definition": "Fable swap request and presented output exist",
      "status": "REACHED",
      "proven": [
        "TU1 sub_82BA34D8 statically reaches VdSwap.",
        "Run 047 produced presented Fable output with a localized black-surface symptom."
      ],
      "source_connected_only": [
        "No monotonic ID yet proves one-to-one propagation from the title call through mailbox refresh to DXGI Present."
      ],
      "gap_to_next": "Identify the exact Fable packet/draw/copy/query stream without payload capture.",
      "experiment_ids": [
        "EXP-STATIC-XDK-001",
        "EXP-SWAP-CORRELATION-001",
        "EXP-DRAW-DECISION-001"
      ]
    },
    {
      "level": "L2",
      "definition": "Exact Fable packet/draw/copy/query stream identified",
      "status": "NOT REACHED",
      "proven": [],
      "source_connected_only": [
        "Pinned ReXGlue source identifies observation points; a source call graph is not a Fable runtime trace."
      ],
      "gap_to_next": "Bounded stream IDs and operation metadata for the exact scene.",
      "experiment_ids": [
        "EXP-DRAW-DECISION-001",
        "EXP-ZPD-REPORT-001",
        "EXP-EDRAM-RESOLVE-001"
      ]
    },
    {
      "level": "L3",
      "definition": "Per-draw registers, pipeline decision, bindings and skip/failure result identified",
      "status": "NOT REACHED",
      "proven": [],
      "source_connected_only": [
        "Run logs contain shader/pipeline hashes but do not correlate them to affected draws or outcomes."
      ],
      "gap_to_next": "Minimal per-draw decision, shader/pipeline identity and binding metadata.",
      "experiment_ids": [
        "EXP-DRAW-DECISION-001",
        "EXP-SHADER-IDENTITY-001",
        "EXP-TEXTURE-METADATA-001"
      ]
    },
    {
      "level": "L4",
      "definition": "Affected character draw, shader, texture, EDRAM pass and resource lifetime identified",
      "status": "NOT REACHED",
      "proven": [],
      "source_connected_only": [
        "Screenshots localize the visible symptom but carry no GPU provenance."
      ],
      "gap_to_next": "Correlate one affected draw through shader, texture, EDRAM and lifetime identities.",
      "experiment_ids": [
        "EXP-CHARACTER-PAIR-001"
      ]
    },
    {
      "level": "L5",
      "definition": "Controlled evidence ties one divergent behaviour to the symptom or clears it",
      "status": "NOT REACHED",
      "proven": [],
      "source_connected_only": [
        "No controlled A/B result exists for any divergence."
      ],
      "gap_to_next": "After L4, change exactly one qualified behavior under a paired controlled checkpoint.",
      "experiment_ids": [
        "EXP-CANDIDATE-AB-001"
      ]
    }
  ],
  "fable_evidence": [
    {
      "evidence_id": "FBL-TITLE-IDENTITY",
      "kind": "TU1 identity corpus",
      "path": "docs/fable2-discovery-pipeline/01-known-facts-and-baseline.md",
      "status": "COMMITTED",
      "facts": [
        "Fable II GOTY TU1 title/media/version 0x4D5307F1 / 0x716F0A0D / 0.0.1.26.",
        "Loaded post-patch image SHA-256 BF7300F7E0DEEE91444ACD50FBE69752F5CFD3CF51358186F1B849DF25A8CB00."
      ]
    },
    {
      "evidence_id": "FBL-G1-SWAP-STATIC",
      "kind": "TU1 static generated-code and Ghidra evidence",
      "path": "docs/fable2-native-renderer/candidate-hook-inventory.json",
      "status": "COMMITTED",
      "facts": [
        "sub_82BA34D8 occupies [0x82BA34D8, 0x82BA3BFC), size 0x724, 457 PPC instructions.",
        "The function directly reaches VdGetSystemCommandBuffer and VdSwap."
      ]
    },
    {
      "evidence_id": "FBL-RUN047-LOG-A",
      "kind": "accepted runtime log",
      "path": "C:\\Dev\\Fable2Recomp\\fable2-run-047.1.log",
      "size": 5242848,
      "sha256": "BDE01B61B5E8C04298BE17C3702BD3B1FA4ED122A47991BA99A0052C12FBA0C5",
      "status": "IGNORED LOCAL",
      "facts": [
        "Loaded GPU plugin xenos from rexgpu-xenos.dll and initialized D3D12 on NVIDIA GeForce RTX 5080, vendor 0x10DE, device 0x2C02.",
        "Created GPU Commands and GPU VSync host threads.",
        "Recorded XamShowKeyboardUI at line 42673."
      ]
    },
    {
      "evidence_id": "FBL-RUN047-LOG-B",
      "kind": "accepted rotated runtime log continuation",
      "path": "C:\\Dev\\Fable2Recomp\\fable2-run-047.log",
      "size": 3276167,
      "sha256": "A32254435C900A6688EC8ECA3583FA364A2F377F5AAB9CB5A455CA3562E7E8FF",
      "status": "IGNORED LOCAL",
      "facts": [
        "Recorded XGI message 0x000B0008 outcomes for achievement IDs 11 and 60.",
        "The accepted user-controlled run continued to Bowerstone Market without a demonstrated GPU blocking failure."
      ]
    },
    {
      "evidence_id": "FBL-RUN048-LOG",
      "kind": "bounded no-input runtime smoke log",
      "path": "C:\\Dev\\Fable2Recomp\\fable2-run-048.log",
      "size": 631212,
      "sha256": "893C6143A43598DE0F79D3B9370C70E11182ECE803D8828F27CEE4BBD6A5FD6D",
      "status": "IGNORED LOCAL",
      "facts": [
        "Loaded the same xenos plugin and initialized D3D12 presentation on NVIDIA GeForce RTX 5080.",
        "This was not gameplay validation and contains no character-draw provenance."
      ]
    },
    {
      "evidence_id": "FBL-RUN047-IMAGE-001",
      "kind": "accepted screenshot",
      "path": "C:\\Dev\\Fable2Phase4Seed\\runtime-run-047\\fable2_2026_08_31_23_04_46_860.png",
      "size": 3520996,
      "sha256": "6378410C35E8DE09BA8492DBB83ED310A0AF88293AB2C07500BBC8249183D015",
      "status": "EXTERNAL LOCAL",
      "facts": [
        "Dog and exposed player skin/head surfaces are black while environment, lighting and clothing render.",
        "The image contains no draw, shader, texture, EDRAM or lifetime provenance."
      ]
    },
    {
      "evidence_id": "FBL-RUN047-IMAGE-002",
      "kind": "accepted screenshot",
      "path": "C:\\Dev\\Fable2Phase4Seed\\runtime-run-047\\fable2_2026_08_31_23_05_20_600.png",
      "size": 3990161,
      "sha256": "E99F15C2466CD2F10B4EF97C328C8A326030F31058C2AE09132F30DE3FA0AEEB",
      "status": "EXTERNAL LOCAL",
      "facts": [
        "The same localized black dog/player-skin symptom coexists with rendered UI and scene content.",
        "Visual similarity alone does not identify a divergent GPU behaviour."
      ]
    },
    {
      "evidence_id": "FBL-PRESENT-SOURCE",
      "kind": "pinned ReXGlue static source",
      "path": "C:\\Dev\\rexglue-sdk-v0.10\\src\\ui\\d3d12\\d3d12_presenter.cpp",
      "status": "STATIC SOURCE",
      "facts": [
        "Guest output is composed before Presenter::ExecuteUIDrawersFromUIThread.",
        "Host UI is then composed before DXGI Present."
      ]
    },
    {
      "evidence_id": "FBL-KEYBOARD-STATIC",
      "kind": "TU1 generated import/callsite evidence",
      "path": "generated/default/fable2_recomp.15.cpp",
      "status": "STATIC SOURCE",
      "facts": [
        "Import address 0x832B9AC4 registers __imp__XamShowKeyboardUI.",
        "sub_82CC2E90 is a direct thunk and the title calls it at guest LR 0x826CDF64."
      ]
    },
    {
      "evidence_id": "FBL-ACHIEVEMENT-STATIC",
      "kind": "TU1 generated message-route evidence",
      "path": "generated/default/fable2_recomp.123.cpp",
      "status": "STATIC SOURCE",
      "facts": [
        "sub_82CC27F8 calls XMsgStartIORequest with app 0xFB, message 0x000B0008, buffer length 8.",
        "Pinned ReXGlue routes this to XgiApp::DispatchMessageSync and UnlockAchievement."
      ]
    }
  ],
  "records": [
    {
      "record_id": "BCK-001",
      "subsystem": "Backend boundaries",